person_id;image_id;caption
user_15;user_15117.jpg;Doughnuts offer a temporary relief, even though the amount of liquid in my sinuses came back this morning with a vengeance. 🖤 Day 6 of my longest cold yet, has yet to subside :/ normally I can bounce back from a cold after a couple days but this one is a doozy. It's messed with my appetite, my brain, and my ability to sleep. I would very much like to resume my normal very busy life anytime now :/ 🖤 But thankful I had Eddie to cart me to @beechwooddoughnuts last week when I had the energy to shower because I just wanted donuts (then my cycle came the next day lol). Period & a cold? Happy December to me 😂 but seriously the sprinkle donut and their chocolate CRONUT is everything. 🖤 Hope any of you fellow sickos are getting lots of rest and liquids. I live vicariously through ye healthy folk. 🖤 #user_15 #beechwooddoughnuts
user_15;user_15118.jpg;I'm on day 4 of this weirdly annoying and headache inducing head cold and I just want to be able to breathe out of both nostrils again so I can go back to the gym! 🖤 I went to a gentle yoga class on Wednesday and since then I haven't had the energy to go work out :( also I'm pretty sure someone going to the gym sick is how I got sick in the first place so I don't want to continue the cycle. 🖤 Anyway I got some epic vegan ramen from @mystic.ramen in the Hamilton Farmer's Market and I am so pumped to recreate this. I had never had tantanmen before and I am definitely now more familiar with the profile. Rich, spicy, creamy and full of umami. PLUS the BBQ seitan from the vegetarian store was a great addition to this. I love when vendors work together! 🖤 #user_15 #veganramen #tantanmen #hamiltonvegan #hamiltonfarmersmarket
user_15;user_15119.jpg;"I am always so thankful to see so many of you making my recipes for your vegan thanksgiving 🥰 you all seemed to really enjoy our #squadsgiving vlog and spread on my channel and that was awesome! I love that so many of you were pumped for your own vegan Thanksgiving because of it and so many of you are making a difference by opting out of animal agriculture and eating a more ethical diet. 🖤 However, I would like to remind you that while it's important to spend time with loved ones over food, it's equally important to remember that what Thanksgiving historically represents is actually awful and everything we stand against when it comes to a more ethical lifestyle. 🖤 Be mindful that when you say ""No one had to die for my dinner this Thanksgiving"", you ignore the historical genocide, cultural erasure, and the ongoing systematic oppression of Indigenous and First Nations people. 🖤 Support Indigenous creators, activists, and communities, either financially, with your time (i.e. volunteering) or simply by educating yourself and listening. They have been fighting for intersectionality and sustainability long before any of us have ever done, and we still have lots to learn from their ongoing fight and lots more work to do to support them. 🖤 #thanksgiving #veganthanksgiving #indigenousrights #intersectionality"
user_15;user_15120.jpg;I'm honestly so proud of these adorable Strawberry Jam Empire Cookies made with frozen #californiastrawberries (AD) 🍓 I made a simple chia seed jam with frozen strawberries so you can control the sweetness and tartness of the jam, and these cookies soften up SO nicely once coated in a lemony glaze and filled with that cheery strawberry chia jam. 🍓 Find the recipe linked in my bio or in my highlights, AND the wonderful people behind @CAStrawberries are hosting a giveaway of ten $100 giftcards for my fellow Canadians (excluding QC) so go enter! I'll leave a link to the giveaway in my stories as well :) 🍓 #frozenstrawberries #strawberries #user_15 #user_15recipes http://bit.ly/2QWdU8j
user_15;user_15121.jpg;Sometimes I still can't believe we got married. Fives months have flown by and we still haven't finished our thank you cards 😬 a lot of things have happened this year and I am grateful for everything despite all that has happened. 🖤 I've been watching some of our old wedding planning videos and reminiscing on the process. Despite how stressful everything was, it was a lot of fun. I've been meaning to finish writing up my wedding vendor and recap post but it's been sitting in a draft for months now haha. Maybe in the new year! 🖤 For now, I am just so happy to not have to plan something that big again 😂 (Eddie is definitely happy to be done with that too hahaha) I love gatherings, especially around food, but dang, wedding planning is a wild ride. So glad that's done! 🖤 #user_15 #veganwedding #aodai #aodaicuoi
user_15;user_15122.jpg;"Good weekends are for long walks across the city, coffee chats, and delicious food 🥰 🖤 Thank you @soostoronto (@fatchoito) for always serving up epic noodles! @mhycal and I shared the shroom braise and char kway teow (because Eddie never wants to share his CKT and doesn't want any part of mushrooms haha) while our friend Kayla got her own ✨vegan CKT✨! 🖤 I insisted on having them try the vegan ""soft shell crab"" which are fried battered black oyster mushroom lettuce cups that are so saucy and delicious 🤤 and the gifted curry puffs were WILDLY delicious (that garlic sauce underneath is life 🙌) 🖤 I normally would get their sago for dessert because it is just SO good, but I had to go across the street to @bangbang_icecream for chocolate sorbet in a vegan chocolate chip cookie 😍 WHAT A DAY. 🖤 #user_15 #fatchoito #soostoronto #whatveganseat #veganfoodshare"
user_15;user_15123.jpg;EDIT: I have been informed that the noodles have egg, despite me asking them the first time I went ://// 🍜  Me: Caaan we get ramen? E: Aren't we doing a ramen tour with Mike and Laura soon? Me: Yeah but I want ramen nooooow... 🥺 E: ...fine. Me: yey! Lub you!! E: Because I enable you? Me: 😅😈 . @kenzoramen has a lot of clearly marked vegetarian options and they assured me there was no egg or dairy in the items we ordered 😁 we both ordered the spicy ramen and some agedashi tofu because tofu is lifeee! Ramen tour will be coming to you in a video prooobably around Christmas time. 🍜  #whatveganseat #user_15 #veganramen #veganfoodshare #hamiltonvegan
user_15;user_15124.jpg;Vegan chicken salad with sooooy curls! I've been obsessed with these, they are seriously magic. Let me know if you want me to turn this into a recipe for the blog? I was just throwing stuff into a bowl when I made this batch and didn't measure it much haha 😅  #user_15 #soycurls @butlersoycurls #bestofvegan #mealprep
user_15;user_15125.jpg;🇵🇭 LUMPIA 👏SHANGHAI 👏  Janelle and I had a blast making these so go watch the video! I'll link the video in stories & highlights, and the recipe in the bio ✨  #user_15 #user_15recipes #lumpiangshanghai #lumpia #filipinofood #whatveganseat #bestofvegan #veganfoodshare http://bit.ly/3391oF4
user_15;user_15126.jpg;COMING💃 SOON 🕺  #user_15 #veganfilipino
user_15;user_15127.jpg;I don't know what it is about this time of year, but a lot of my life changes occur around November. I went fully vegan 6 years ago around this time, I started weight lifting this time last year (and then fell off around New Years because my old gym did a bunch of shady stuff), and this year, I went hard into prioritizing body positivity and learning to accept me. 🖤 New haircut, new fitness routine, new focus on my goals. Life has thrown a lot at me and Eddie the past year and we are refinding our footing. Winter always seems like a fresh start for me and it's time to brave the cold. 🖤 Do you ever feel this way about winter? What time of year do you tend to adopt new changes? 🖤 #user_15 #whatveganslooklike #vegansofinstagram #vegansofig
user_15;user_15128.jpg;Life is short, hold your friends close and your loved ones closer. Make time for your friends and fam y'all. Life is busy and wild but time with each other is all we have. 🖤 #user_15 #democracyonlocke
user_15;user_15129.jpg;Love me some moody mushrooms! These are the main star in my vegan pâté that I posted on the blog this week. I've already devoured half of it...for er... Quality control 😅 but there's enough for the demo today bahah. 🖤 Currently in London, Ontario to demo some lemongrass tofu banh mi and I am hunnngry! Can't wait to see what is good at @vegfestlondonon! I'm on stage at 4:30, hope to see y'all there! 🖤 #user_15 #veganfoodshare #bestofvegan #mushrooms🍄
user_15;user_15130.jpg;Life threw me some curveballs this week and I only needed a couple days to bounce back unlike my usual week of super lows. I think my new gym habit has helped me get out of those funks a lot faster since it sort of forces me to fuel myself properly and shower. Is that TMI? 🖤 Whenever stuff gets really rough I tend to zombie up and just sort of drift through my day with no appetite or motivation, and it's really frustrating when there's so much I want to get done. Even sitting down and forcing myself to work produces seriously subpar content so I've had to just wait it out and jump on the next wave whenever one begins to crest. 🖤 Coming out of my funk (and eczema flareup) yesterday, I finally got to prep the pâté and đồ chua for my lemongrass bánh mì demo at @vegfestlondonon and I'm so excited! I hope you'll be there :D my demo is at 4:30, so I hope you stick around the festival to see me do what I do for videos but in real life (you probably will see the weird stuff I usually cut out of videos baha) 🖤 Link for the pâté recipe will be in stories/highlights (whenever IG lets me) and in the bio. Hope that if you are in a low right now that you do something to take care of yourself. A good shower or a warm meal goes a long way. 🖤 #user_15recipes #user_15 #whatveganseat #veganpate #bestofvegan #thefeedfeedvegan http://bit.ly/32tKxfZ
user_15;user_15131.jpg;My vegan bánh xèo recipe is FINALLY live. Stuff kept getting in the way of me testing it and posting it, but it's here and you now can make ultra crispy savoury pancakes too! 🖤 Recipe is linked in the stories/highlights and video is live on the channel 🤗 I hope you like it💃 🖤 #user_15 #user_15recipes #banhxeo #bánhxèo #vietvegan #whatveganseat #veganfoodshare http://bit.ly/2JB52Az
user_15;user_15132.jpg;Marmite, avocado, and furikake! Just listening to my bod and my body wants iron-rich, fatty and salty foods. (Hi hello menstrual cycle, I HEAR YOU). I started a slightly more aggressive gym program (the foundation program by @stephanie_buttermore), so I need to get the ball rolling in the mornings with better fuel than ramen 😅 ramen is love, ramen is life, but that was too much liquid for me before the gym bahaha. 🖤 Today I'm fueling the gym with this 'cado toast and a cup of tea. I've exited coffee phase and am deep in orange pekoe. My caffeine headaches have mostly gone away but I do have a slight thrum in my head in the mornings when I don't sleep very well, so a hot cup of tea with @silk_canada creamer and a touch of vanilla sugar has been 👌 🖤 Got a big to do list today, and I am very excited to get through it! Although I also have been trying to feel ok when I don't get through my entire list. Because I am not a product, I don't need to be productive to be valued, which is a WILD concept in this v capitalist society. 🖤 #user_15 #whatveganseat #veganfoodshare #avocadotoast
user_15;user_15133.jpg;THE BEST TIME OF THE YEAR! 🍂 I know the weekend is over, but there is no time like the present to go outside and appreciate the beauty that is autumn leaves. I love the crunch of leaves, the smell of earth and rotting leaves (😂), and the crisp wind through the trees. 🍂 It's a reminder that I have to let go and ready myself for change. Big things on the horizon and I have to let be what I can't control and just go where the path leads me. I trust that with the support of my family and friends that things will all work out. 🍂 In the meantime, bánh xèo recipe will finally be up on Wednesday! I'm hyped 🤗 #user_15 #whatveganslooklike #vegansofig #mountnemo #brucetrail
user_15;user_15134.jpg;My family is wild and chaotic but they are family so I love em no matter what! I love that they love food as much as I do so it's always extra fun taking them out to eat because they are just as enthusiastic about delicious Asian food as I am. 🖤 My mom, my brother and I CRUSHED this rendang from Little Asia and it was wildly delicious. We also ordered the laksa (no egg), peanut tempeh, and pad kee mao because... I mean, noodles are life. 🖤 I really want to take them to @fatchoito next so they can experience delicious Malaysian food but that means one of us would have to drive to the city and both my mom and I dislike driving 😂😂 (this is usually when we ask Eddie to drive hahaha). 🖤 In any case, I am feeling very thankful for family, even though they drive me up the wall sometimes, as families tend to do haha. 🖤 #user_15 #littleasia #whatveganseat #veganfoodshare
user_15;user_15135.jpg;(AD) I know it's fall when one of my favourite varieties @sweetango_apple comes into season! They're only around for a short amount of time, especially this year since Hurricane Dorian really hit the crop hard in Nova Scotia this year, but I am so happy and thankful we still have some! Definitely grab some while supplies last. 🍎 A child of the Honeycrisp and Zestar apples, SweeTango apples have a perfect balance of a sweet and juicy crunch with a touch of tanginess. They are CRUNCHY and so dang good. Apples are one of my favourite ways to fuel hikes or the gym, that fast absorption of sugar combined with fibre helps me keep my energy up to keep walking and peeping these gorgeous fall leaves! 🍎 Especially since I am a huge sucker for inhaling granola bars and fig bars pre-gym, apples are a wrapper-less alternative that is easier on both the planet and my wallet 😂 I found these SweeTango apples at Fortinos in Hamilton, but you can find them at Longos, Costco, Loblaws and I believe alsooo Sobeys (but I am a PC points gorl lol) 🍎 #user_15 #sweetango #sweetangoapples #whatveganseat #veganfoodshare
user_15;user_15136.jpg;Another veganized Filipino comfort food classic! Janelle challenged me to veganize chicken sopas, which is a rich and creamy chicken and macaroni soup, traditionally made with evaporated milk! 🖤 Of course, we made everything all vegan and she said it tasted like the OG 😲😲 watch our latest video, linked in the highlights/stories, and recipe will be linked in the bio! 🖤 #user_15 #user_15recipes #veganfilipino #sopas #bestofvegan #veganfoodshare #whatveganseat http://bit.ly/35WnFsm
user_15;user_15137.jpg;Practicing my onigiri skills! Experimenting for a blog post coming soon, but most importantly, playing to make some fun bentos for a couple of my friends who are coming on a hike to see the beautiful fall leaves with me. 🍙 Trying to go for more traditional Japanese, but vegan! I bought some vegan shrimp and of course, panko and avocado for some classic Japanese flavours. Unfortunately I couldn't find any pickled umeboshi otherwise I would have tried that too. 🍙 This onigiri was seasoned with some expired (lol) vegan furikake, @ikeacanada seaweed pearls, and soy curls mixed with some mayo and soy sauce. I also have some vegan pork floss that I kind of want to try to make into soy sauce bonito flake mix as a filling, but I'm not sure how well that will go together! 🍙 I just ate so much rice and mayo but it was so good 😂 Way too full now! Can't wait to peep some leaves and eat some onigiri with wonderful people. Any suggestions for fave Hamilton area hikes? We're a mix of beginner/intermediate hikers, but honestly my cardio sucks either way 😂 🍙 #user_15 #whatveganseat #veganfoodshare #veganonigiri #veganjapanese
user_15;user_15138.jpg;"I got to catch up with an old high school friend that I have chatted with sporadically over the years but I'm pretty sure the last time we physically saw each other was in high school! 🖤 We went to @theheartyhooligan and I was blown away at how tasty this ""meat-lovers"" pizza bagel was. 10/10, would eat again! It is this rad vegan punk cafe with a food menu, coffee, drinks and a straight-edge menu too. Such a fun space full of amazing art too. We yammered on about old friends, food, mental health, books, and before I knew it, the two hours I had to catch up flew by and there was still so much more we wanted to talk about. 🖤 I can get along with pretty much anyone, but there are only a few people I manage to click with so quickly that we can't stop talking. It's always a fun time and I am so thankful that even now, at 29 and well after my more social years I can still connect with new (and in this case, old) friends. It's not like this with every new friend I make and it's always so nice to experience. 🖤 As a fairly introverted extrovert growing up, I was always terrified that I wouldn't make friends when I moved to a new school/place (I went to 4 elementary schools), but it's kind of cool seeing that I have so many good friends from each chapter of life. Some fall away and you drift because of changing interests, but that's just natural haha. 🖤 Anyway, I am just very grateful for patient and forgiving friends because this awkward duck is bad at juggling stresses and the last few months have been a doozy. It's nice to feel understood and heard and I can't wait to catch up with my friends again now that things have finally started to settle down. 🖤 And likewise, I am grateful to you. The comments on my YouTube videos and posts here have been so nice to read even if I haven't been able to answer everyone. Y'all are wonderful. Thank you for being here. 🖤 #user_15 #whatveganseat #bestofvegan #veganfoodshare"
user_15;user_15139.jpg;I love fall but I will certainly miss the lush green of summer 😍
user_15;user_15140.jpg;It was sweater weather but we busted out the BBQ for this vegan inihaw na manok (filipino BBQ chicken) all the same. Video with Janelle is up on the YouTubes and we chatted tons about growing up as Asians! Janelle grew up in Toronto while I grew up in a small town in Ontario, while Toronto was more diverse than where I was growing up, the food shaming from our peers was the same!! What's up with that?! 🖤 Who wants to live in a world without curry, (vegan) fish sauce, seaweed, sushi, noodles, and fried rice? Dang y'all. I have hope that all the wonderful parents I know are sharing food from different cultures with their kids and showing kids to be curious and respectful about foods from other cultures, rather than mean and disgusted. 🖤 Food is comfort, and it never feels good to have your favourite foods from your upbringing be shamed. May we as adults continue to practice curiousity and respect when it comes to trying new foods and learning about other cultures 🤗 🖤 #user_15 #whatveganseat #veganfoodshare #filipinofood
user_15;user_15141.jpg;"Sadly my last Montreal food pic: @swirlmtl and their epic grapefruit and coconut swirl. Y'all, I don't care what time of year it is, I am always down for soft serve. I am so bummed that they weren't open for 2/3 days I had to explore in Montreal because you KNOW I would have eaten there every dang day haha. 🖤 I had a lovely chat with someone who had been vegetarian for 20 years and was contemplating the leap to fully vegan and he asked me about what made me go vegan. I explained that even before I was vegetarian, I refused to eat veal, and when I learned that the veal industry BECAUSE of the dairy industry, I was like, oh dang. It was a slap of reality, and the person I was talking to seemed motivated to go fully vegan! 🖤 But back to that realization, it made me feel so silly at the time. I did not realize that cows only produce milk after they've given birth, and if we are drinking the milk from a cow, the baby doesn't have food. Et voilà, veal industry. 🖤 I don't love talking about the terrible stuff that pushed me to go vegan, because it ain't pretty and I never want to shame people for what they don't know. It sucks, and I get that ice cream, cheese, and butter are tasty, but for me, as someone who has always wanted kids one day, the idea of taking someone's baby away so we can drink her milk made me so sad that I couldn't do it anymore. 🖤 Anyway, fast forward 6 years (I don't know my ""veganiversary"", only that I went fully vegan by this time 6 years ago), there are SO MANY dope vegan ice cream options. Maybe not in more rural areas, but at least in most urban centres, grocery stores have at least one brand of vegan ice cream. AND it's not that grainy icy stuff we used to have to eat. What a time to be vegan! 🖤 Anyway, I do my best to encourage people for the steps they take to go vegan. It's not easy sometimes. There is certainly a learning curve, and as someone who knew how to cook and bake, it took me about a year to make the transition, and I was already vegetarian! But it's been 6 years now and I am so grateful for this lifestyle. I have learned so much and I feel so much more at ease with my food choices. 🖤 What sparked the change for you?"
user_15;user_15142.jpg;I had a blast veganizing this Filipino classic with @janellecarpenter 🖤 Inihaw Na Manok, aka BBQ chicken was easily made vegan with a magical vegan ingredient 😁 🖤 Video and recipe are live, link in the bio and stories/highlights! Any guesses what our second Filipino recipe we're going to make next?? Hint: it has macaroni in it 😁 we also mention it in the video haha. Hope you enjoy! 🖤 #user_15 #user_15recipes #whatveganseat #veganfoodshare #veganfilipino #bestofvegan
user_15;user_15143.jpg;I think I finally got the recipe right! Vegan bánh xèo in the works! The trick I have discovered is that the batter needs to be thinner than you think it should be, and you'll get those perfect crispy edges! 🖤 I found vegan shrimp and king oyster mushroom to be my favourite fillings, and if I were better at time management, mung bean would be good inside too. But since Eddie doesn't like shrimp or mushrooms, tofu is his filling of choice. Hopefully will be filming this tomorrow and getting the video out in the next month! 🖤 So many videos I need to edit for you :D I'm actually so excited for you to see them all. Happy Thanksgiving to those who celebrate! I am joining a friends potluck later tonight, but I always use Thanksgiving as a reminder that we live on stolen land and that we all need to do the work as settlers to support indigenous folks and the work they do. They took care of this land and it's inhabitants way better and way more sustainably before we even realized it was important. 🖤 #user_15 #whatveganseat #veganfoodshare
user_15;user_15144.jpg;"I only have a few more shares from Montreal, promise! I'll get back into my own recipe and food shares ASAP! Here is the little feast from @yuanvegetarian that I was actually so surprised by! 🖤 You order from a well-marked menu (because not everything is vegan) and you get an AYCE feast! I quite enjoyed the sushi, tofu, and tempura, but my absolute favourite was the salt & pepper ""seafood"". I've seen salt & pepper seasoned stuff on @marystestkitchen but never had tried it myself. So simple but so tasty! 🖤 Portions are small but thats just so you don't get in over your head while ordering haha. Its All You Can Eat, so as long as you eat everything you order, you can keep ordering! It was fairly reasonable in terms of pricing too! $18 for lunch I believe. 8/10 would eat again! 🖤 #user_15 #montrealfood #montrealvegan #yuanvegetarian"
user_15;user_15145.jpg;There are a lot of new folks and I thought since it's been a hot minute I'd reintroduce myself incase you aren't familiar with me! My name is Lisa, 2019 has been a hell of a year for me, full of highs and lows. I got married, I had tons of amazing adventures, I bought a house with my favourite human, and I restarted a fitness journey and fell in love with lifting, which I thought I would always hate. 🖤 I also experienced a lot of cancer and death in the people around me this year. I got hit with a wild amount of life curveballs and I was humbled by how little I could handle simple things I took for granted. I've learned a lot about my limits, myself, and I have lost my way a bit when it comes to developing recipes. My palate has drastically changed from when I first started my food blog in spring 2011: I went vegetarian in winter 2011, vegan in 2013, and went from being a baking blog to whatever it is I am now that I lost my sweet tooth. Veganism, sustainability, and intersectionality are my new loves and hobbies and I am finding it hard to juggle them all and create cohesive content haha. 🖤 2020 is my third decade on this planet and I have big plans and hopes! I'm still figuring things and I hope you guys will be here for the ride once I am fully back in the drivers seat. I'm so happy you're here with me and I would love to get to know you more! Who are you? Where are you from? Are you vegan? What would you love to see from me? 🖤 #user_15 #whatveganslooklike
