person_id;image_id;caption
user_15;user_15146.jpg;Unpopular opinion: I didn't really enjoy @invitation_v 😬 the server was absolutely lovely and the kitchen was helpful in finding tree-nut-free options but y'all, my options were fairly limited and honestly, I tend not to enjoy Asian food made by non Asian folks. It is usually really westernized on top of being veganized and I just don't dig it 😅 🖤 I tried the satay skewers, but the peanut sauce was substituted with a chipotle sauce because apparently the peanut sauce had tree nuts in it too. The satay itself was good, a little salty, but I was really bummed about the lack of peanut sauce haha. 🖤 Eddie ordered the Yuba general tso if I remember correctly, and the yuba itself was really unique and tasty, but the veggies and rice were lackluster. I tried the rice and it didn't taste steam-cooked (or maybe it was just undercooked), but apparently I've ruined non-Asian style rice for Eddie because now he agrees steamed rice is superior 😂😂 🖤 I also got the sushi, and it was good, but not nearly as good as the sushi from Sushi Momo. I was spoiled by the epicness of that sushi I think haha. But again, it was a super expensive meal for two starters and a main! I think still around 55$ with tip and no drinks. Maybe I didn't order the right things but dang. I was super disappointed. 🖤 There were a lot of burgers and Asian-influenced bowls there, but I wasn't feeling a burger in such a pretty place, and I wasn't feeling westernized Asian food. I heard such raving reviews that ultimately I was just really disappointed. Let me know your experiences there, good and bad? 🖤 #user_15 #montrealvegan #invitationv #montrealfood
user_15;user_15147.jpg;I know I've been sharing a lot of Montreal content lately but we ate at so many places I wanted to let you know what I thought of 'em all! I initially came up to Montreal for @fvmtl to give a talk about intersectionality and veganism and then Eddie and I decided to extend the trip to be our honeymoon (sort of) because we haven't been able to afford a proper trip haha. 🖤 We had to cut a few corners and our Airbnb was a hot mess, but we had each other and lots of food so that's all that counts, right? Haha. Here are a few little snippets of our excursion where we ended the night with some @beavertails_official! They're not all vegan, but the pastry is vegan and many of the toppings can be vegan so long as the pastry isn't buttered. Their menus are typically marked for vegan options too! Eddie got the Oreo beavertail, while I got my favourite: Killaloe Sunrise (cinnamon sugar with a wedge of lemon). She isn't the most aesthetic looking but she's the right amount of sweet & tart haha. 🖤 I have a vlog coming soon of the food we ate and some random things we did during our trip but I wasn't very diligent about filming because well, it was our honeymoon hahaha. We want to take a big trip somewhere one day where we can afford a nicer place to stay, but for now, our fleeting few days in Montreal were plenty of fun 💕 🖤 Also, hello new people! I feel bad that I messed up my theme on the day @vegnews shared their roundup of food accounts 😂 but hi, hello, I'm Lisa. Here you will find lots of vegan food, reviews, and probably a lot of oversharing hahah. 🖤 #user_15 #montrealvegan #bestofvegan #veganfoodshare #whatveganseat
user_15;user_15148.jpg;"My favourite cuisine will always be Vietnamese, but Thai with the familiar levels of spice and sour flavour is close up there. I was excited to get Eddie to try @restaurantchuchai in Montreal, which is an all vegan Thai restaurant and it was full of delicious oily noodly goodness. 🖤 I got the pad kee mao, Eddie got the pad Thai, and we got the panang ""duck"" with sticky rice. My pad kee mao was very tasty and Eddie was very into his pad Thai (too sweet for me haha, but all pad Thais are like that for me), and the panang curry was good but far too salty for me. 🖤 Some of you told me I had to try the crispy ""duck"" but I totally missed it on the menu. Next time! We have tentative plans with our (newly married!!) vegan couple friends to do a weekend trip to Montreal to hit up some of our favourites again. The strategy with more people is that more people = more dishes we can share 😈😈 but not for Eddie because Eddie doesn't share food! 🖤 #user_15 #montrealvegan #whatveganseat #veganfoodshare #chuchai #bestofvegan"
user_15;user_15149.jpg;I got to try the epic @bowheadpub last week and holy it is decadent! I really wanted to try the po boy but it had nuts in it, so I panicked and ordered the Monster Burger which had both a vegan chick'un and @beyondmeat burger patty which was WAY too much for me, but the pretzel bun was so good! 🖤 We also ordered the animal fries which were HUGE, Eddie and I thought we were just upgrading our side to a side-sized animal fries but nope. Its the full size haha. Definitely recommend sharing but it was actually so good too. We also ordered the chick'un wings which were interesting and a lot more stringy than I was expecting. Still good though! 🖤 Luckily we brought containers for leftovers because we basically had another full meal leftover afterwards but it was still really tasty warmed up the next day haha. 8/10, very tasty, would eat again. Would be even better if you enjoy beer because it was the perfect meal to have with some draught beer. 🖤 #user_15 #montrealvegan #bowheadpub #veganfoodspot #whatveganseat #veganfoodshares
user_15;user_15150.jpg;I ate so much rich and salty food in Montreal that my body was seriously craving some veggie freshness, so for lunch before our hike up Mont Royale, we stopped by @lapanthereverte for some falafel goodness. 🖤 Eddie and I both ordered the falafusion which is basically a westernized falafel pita, and we both wished we got the traditional instead haha. It was super delicious, the pita is magically soft and chewy and the falafel itself is DREAMY! But I wish I stuck with my gut and got that good good pickled veg and tahini sauce. 🖤 We also got the poutine and was surprised that they used sweet potatoes instead of typical potatoes, and they had a brined tofu as their vegan cheese curds. Honestly, it was so dang good but not quite what I expected. The tofu chunks were tasty and reminiscent of cheese curds, the only bummer is that tofu doesn't melt haha. Would eat again though! 🖤 We wanted to get some falafel for the road home but traffic was so bad we forwent navigating Montreal which is like 80% always under construction hahaha. But all in all, a delicious time. I've eaten a ton of their falafel a few years ago, and I clearly would eat again haha. 🖤 #user_15 #montrealvegan #bestofvegan #whatveganseat
user_15;user_15151.jpg;I freaking LOVE bagels. I first came to Montreal when I was 17 on a work exchange for 6 weeks at a daycare where I basically just played with 18mo old babies for 8 hours a day and it was amazing. During the rest of the days and weekends, I zipped all around Montreal with our cohort of fellow teens on work exchange from all over Canada and it was one of the best summers I could have ever asked for. 🖤 Those six weeks were full of adventure, summer love, and most of all FOOD. I remember trying Montreal bagels for the first time and having my mind blown at how dense and chewy they were, compared to the giant ones I was used to at home. Montreal bagels have this other kind of pillowy chew that is unlike any other. 🖤 Typically they are either cooked briefly in a honey bath and/or coated with an egg wash, so the famous @stviateurbagel and @fairmountbagel aren't traditionally vegan, but Fairmont said they would do a vegan batch with 24 hrs notice when I was researching a couple weeks ago. I reached out about 36 hrs before I was going to stop by for bagels, but they didn't answer so no Fairmount bagels for me haha. 🖤 However, the champions at Bagel Beaubien were so nice and let me take pictures of their bagels AND have a bunch of vegan options. I left with a bag of warm, fragrant sesame bagels that I ate with the FANTASTIC @lesojami garlic & herb fermented soy cream cheese, only to come back just before we left Montreal so I could get another half dozen sesame and some cinnamon raisin ones for Eddie. 🖤 They are simply so delicious and I'm so thankful that Beaubien has vegan bagels without any hoops to jump though! 🖤 #user_15 #bagelbeaubien #montrealvegan #bestofvegan #veganfoodshare
user_15;user_15152.jpg;"We're on the way back home now and our mini moon has been short and sweet 💕 we had some hits and misses when it came to vegan restaurants here, but I have a feeling it's mostly because of my nut allergies. I'll share my review of all the places we went to over the next week or so, but let's start off with the first dinner once Eddie got into town. 🖤 I did my best at informing restaurants ahead of time of my allergies but sometimes restaurants cater really hard to soy-allergic folks and rely a lot more on cashews and almonds. Unfortunately I'm kind of used to it haha, but we make do. The servers at @lovrestaurant were really kind and accommodating and did their best to communicate with the kitchen. They were lovely! 🖤 Foodwise, we had just an ok experience. I ordered the Truffles & Caviar, which were soy sauce caviar bubbles (I assume agar or tapioca based) with shiitake on a bed of zucchini noodles and a drizzle of truffle oil. It was fragrant, interesting and beautiful, but I had to ask for salt because there wasn't enough seasoning (aside from the soy sauce caviar). Once salted it was better, but this dish lacked protein. 🖤 I also ordered the kale & squash mac and cheese but because the almond parm was a no go for me, I forwent the parm. This was so bland I had to add a decent amount of salt to bring out the squash flavour. I like savoury foods but I'm actually pretty sensitive to salt, so if something was underseasoned for me, that means it was pretty bland. 🖤 Eddie ordered the caesar with tempeh bacon (I know, he willingly ordered something with tempeh, SHOCK), but when the large arrived, we were kind of surprised at how small it was and it also didn't even have any tempeh. Eddie said ""it's aight"" 🤦🏻‍♀️ but yeah, I was pretty surprised it was so small. 🖤 With tip and no drinks, the total was $55 for those 3 dishes, two of which were starters. I also was hungry again about half an hour later (which, fair, I did order zucchini noodles). I know LoV is coming to Toronto soon so I hope things will be better, but so many of you recommended this restaurant to me I am really sad I didn't have a better experience. 🖤 #user_15 #veganmontreal"
user_15;user_15153.jpg;"My Montreal trip has been so full of delicious food so far and I definitely need to come back and try some other places we can't squeeze in. I had the loveliest time with @odilejp talking veganism, politics, photography, and food and it was so nice to finally meet. 🖤 We shared a meal at @sushimomomtl and it was seriously so delicious. They NEED to come to Toronto to show them how vegan sushi can be done. Tenon vegetarian is great, but they have a ton of stuff that has dairy and eggs in it, and is totally unnecessary (if only that veg salmon was vegan 😭) 🖤 We ordered the ""poutine"", which was sweet potato maki rolls fried and under a blanket of various sauce/toppings and some gooey melted cheese. Was it delicious? Yes! Would I eat it again? For sure! But definitely not something I would consider poutine 😂. We also had the shared meal for two which came with beet tartare (7.5/10, needed more taro chips haha), miso soup (8/10, it was delicious and oddly kinda sweet) and an assortment of 5 nut-free rolls which I cannot remember what they are. 🖤 My absolute favourite one of the bunch was the bottom right one in that last photo, it had crispy puffed quinoa on top I think, or maybe it was rice? But inside was umami mushroom goodness that I couldn't believe. So good! There was also a jackfruit one that was pretty delicious. 🖤 I just want more sushi now, but there are still plenty of places I need to try first before I do a repeat 😂 Montreal!! You have so much amazing vegan food. 🖤 #user_15 #whatveganseat #veganfoodshare #sushimomo"
user_15;user_15154.jpg;(ad) My favourite summer fruit is definitely the juicy peach. I'm a sucker for peach anything, so I am so happy I was able to visit a few peach orchards and packing facilities to share the behind the scenes with you. 🍑 My latest video was all possible thanks to @producemadesimple and I hope you enjoy all the peach goodness. I have a link in stories/highlights and the bio for you if you have seen the youtube video already 🤗 🍑 📸:@jesusmazaphoto #user_15 #producemadesimple #eatmoreproduce #user_15recipes #whatveganslooklike http://bit.ly/2m5XvAN
user_15;user_15155.jpg;It took me a while to be able to listen back to this footage where I am living my best life frolicking in the peach orchards and giggling with some of my favourite people after what has happened in the last month. 🖤 I finally was able to edit this video and I'm so glad. It was truly one of the best days of the summer and I'm so happy I can share it with you. Check out my latest vlog from the @producemadesimple peach industry tour (ad) and celebrating @laurafraserlettering's veganiversary from a month ago. It was such a wonderful day. 🖤 All of this delicious food was from Zen Gardens, and YES! It is all vegan. Their menu is mostly vegan but there are a few vegetarian items to watch for. Everything is clearly marked, though. I'll leave a list down below of all the things that we ordered, but you should just watch the video 🤗 🖤 In order of appearance: siu mai, bbq buns, hot & sour soup, tom yum fried rice, fried enoki mushroom balls, bbq seitan & curry vermicelli. We also had sweet & sour soy balls but I didn't get a picture. Video linked in my stories & bio 🤗 🖤 #user_15 #bestofvegan #veganfoodshare #zengardens http://bit.ly/2m5XvAN #user_15recipes (not actually a recipe its just how I get links to show up in my bio lol)
user_15;user_15156.jpg;I take any excuse I can to go to @bibimbap_to because of how delicious their kimchi fries are. They are literally perfection. 🖤 I'm doing better than I was last week, and I have been getting frustrated at how useless I am these days. It's days like these where I miss the structure of my old office job back in Ottawa and just being another cog in the machine. I often worry if I made the right choice, to do what I do now. 🖤 I am not the best vegan advocate. I'm not the best content creator. But from what y'all continue to tell me over and over, I am the best me and the content I make is apparently funny and relatable to all you weirdos and that is reassuring. I like making you laugh and I love when y'all send me pics or videos of your babies or fur babes watching my videos. Seriously the highlight of this job hahah. 🖤 Hoping to get a video out about peaches this week before peach season is totally over because there was some amazing stuff I learned about peach farming in Ontario earlier this summer.
user_15;user_15157.jpg;Kind of a zombie, but trying to maintain some sort of control in my life by cooking more and going to the gym more. I feel productive with my body but my mentally I'm still kind of struggling. 🖤 Been experimenting with a baked buffalo tofu for a workshop with @darnabati soon but I'm really struggling to find inspiration to cook. My appetite hasn't been that great, so I'm just trying to work with what I've got. 🖤 Trying to get some work done today because bills still gotta get paid and when you're self employed, if you don't work, you can't get paid 😪
user_15;user_15158.jpg;Sometimes I get flack in the comment section of my videos for eating so much junk food. Especially on my recent Buffalo haul, but it's not like I'm going to buy fruits and vegetables in Buffalo when I can buy that here. That doesn't make sense 🤔 🖤 I've been doing a lot of work to move away from assigning value to food (guilt/guilt-free, cheat meals, clean, indulgences) and been trying to focus on eating whatever it is I feel like eating. I've even been accused of eating so much processed food on a vlog where I eat avocado toast and hummus flatbread for 2/3 meals. Excuse me? 🖤 So I eat ramen when I feel like it, and greens when it suits me. Obviously it's healthier to not eat any processed foods at all, but what is life without potato chips, instant ramen, or vegan cheese? Lay off y'all. I have never been about eating perfectly healthy, I just eat what feels good to me. 🖤 Recently I've been feeling the onset of a cold creeping up on me and I've been trying to stave it off with plenty of fruits, veg, fibre, and liquids, but I wanted comfort food too 😂 enter @freshrestaurants after eating too much at @vegfoodfest! 🖤 Top left was @meatfreeathlete's wrap but I got the Essential Greens bowl, basically steamed Asian greens on brown rice with marinated tofu (tbh I thought I'd get more than one piece when I ordered a small) and peanut sauce. It was satisfying and tasty, but I wanted the buffalo cauliflower so I ate until I was comfortable and felt good 🤗 🖤 Also I had the ginger fireball, which was a shot of juiced ginger with hot water and maple syrup with candied ginger on the side and it was just what I needed to stave off the cold. 🖤 Feeling kind of allergic to stuff today and trying to work but the videos I try to make when I feel terrible are also terrible so I'm going to take this big cancer moon energy and pour it into doing some deep cleaning in my house. Also grieving is weird. The logistics after people die are weird and frustrating. I am grateful to all of you and my friends for lending their ears these past few days. 🖤 #user_15 #bestofvegan #veganfoodshare #freshrestaurants
user_15;user_15159.jpg;"Thai food has a special place in my heart. It is so similar to Vietnamese cuisine with the use of spice, acid, and umami flavours that my savoury noodly heart can never resist.  The things that set Thai and Viet food apart for me is Vietnamese food often sneaks in freshness in ways that balance the richness of a dish, or ease the digestion with a functional but delicious part of the meal. And honestly, the practicality, variety of texures, and the deliciousness of Viet food will always win out over other cuisines for me. Maybe I'm biased though haha.  Anyway, Thai will always be a close second to top Asian cuisines for me, especially when prepared by Little Asia in Dundas. I took @rollercoastervegan and we ordered the tempeh satay (10/10), the green papaya salad (8/10), the nasi goreng (9/10), and the laksa (10/10). Eddie had pad thai because ""Eddie doesn't share food"" 🙅‍♂️ and they gave us some free fried banana because they see me come in way too often with different people all the time 😅"
user_15;user_15160.jpg;As I mentioned in my last post, it definitely feels weird to feel happy, but equally weird to feel sad, but I am so grateful to the people who have swarmed me with support this weekend. As an extremely introverted extrovert, I am equally energized by people as I am worn out by them, but being with my family, @rollercoastervegan, @twomarketgirls, @meatfreeathlete, @lovewildlivefree and of course 🖤@broadcasteddie 🖤 has been so helpful for me through this grieving process.  This weekend has been full of good food, people, and feelings and it is wonderful to feel acknowledgement and validation for how complicated my father's death is for me. I am feeling so thankful for all your messages, comments, and DMs about this all, if I don't answer, please know I have read it and appreciate it, I'm just a little overwhelmed.  Trying to throw myself into exercise, work, and some distraction to get myself through the next few weeks to rediscover my normal. But in the meantime, there's always comfort in good food 😊  This was a combo of chickpeas, potatoes, and plantain in my repurposed Earth Balance tub at @vegfoodfest from @dscaribbeanfusioncatering. I loved seeing so many people bring containers from home to Veg Fest. Y'all make my eco-nerd heart happy.
user_15;user_15161.jpg;Today was the first of seven Sundays to start my dad's journey to the next life. I haven't talked much about him, honestly we didn't have a good relationship to begin with, and havent even had a relationship at all for the last few years. But I figured I should explain what has been going on lately. My dad was diagnosed with liver cancer earlier this year and passed away on Thursday early morning.  Even though we had a really complicated relationship, I came to see him before he passed. It was hard and confusing, there was absolutely no closure, and I'm trying to grieve amidst living through this super busy season of veg fests, travel plans, and upcoming projects.  It feels weird to be sad, it feels weird to live my life happily. But I'm working on grieving the relationship we never had and mourning the painful one we did. Duty and family obligations are difficult and weird, but this too shall pass. Thanks for everyone for being understanding on why I haven't been posting new recipes or videos.  The noodle soup above is Bun Bo Hue, from Saigon Lotus in Toronto. Hue is where my dad was originally from and it felt fitting for this post.
user_15;user_15162.jpg;It's been a really hard week for me, but having good food and good company to distract me has been wonderful. @vegfoodfest has been a blast so far, and we've been eating so much great food! 🖤 Got the Big Mock and chili cheese fries from @sausagepartytoronto and they are always a good time. Rad folks, rad people 😍 🖤 I've got some more pictures in the stories, but @twomarketgirls and @rollercoastervegan indulged me in a lil picnic before our day got started 👯 🖤 #user_15 #bestofvegan #vegfoodfest #torontovegan
user_15;user_15163.jpg;A little protein packed lunch today: tofu scram with firm and soft tofu to get that ultimate eggy bounciness, of course with some black salt to get that epic eggy flavour. I also added some spinach, salsa and hot sauce for some flavour. 🖤 I've got some videos I need to edit to get out, but I haven't been experimenting much in the kitchen lately. Some stuff happening in my personal life is kind of taking over and I'm still figuring out how to deal with it. I don't know how people carry on in their day to day lives when personal stuff takes over. Sometimes I think I must be really weak because I'm so sensitive to this kind of stuff. 🖤 It feels weird to be happy and equally weird to be sad. I've been distracting myself with video games, the gym, events, and the busy-ness of food fest season, but I need to deal and get shit done again. I'm just having a hard time. My mom, brother, Eddie and I are in good health for any of y'all who are concerned. Thanks for your patience.
user_15;user_15164.jpg;"Visited some vegan friends in Stratford and none of us could turn down the opportunity for some showstopping buffalo chick'un sandwiches on a pretzel hoagie from @theplanetdiner and their amazing donuts. 🖤 Sandwich was a HOT MESS but it was a party in my mouth and we've established that I'm consistently a hot Leo cancer moon mess soooo I mean, it's just on brand now. Had fries and gravy on the side because the caesar salad had nuts, but both fries and gravy were deeeeelicious (btw, if you have a severe nut allergy I do not recommend dining here lol, nuts errwhere). 🖤 Eddie got the strawberry donut (tasted like strawberry pocky), I got the chocolate marble donut, and we still have the apple fritter to eat for breakfast tomorrow 😈 but these donuts were so FLUFFY but also rich because they use coconut milk. 🖤 10/10 would eat again. The only thing that sucks is that they have meat options (their slogan is ""where herbivores can bring their carnivores"") and while I applaud a small town like Stratford in having a place with so many vegan goodies, it is confusing and kind of jarring to still see meat as an option. 🖤 The menu doesn't have any signage that it's like this btw, this is real meat. You kind of just have to realize that the pulled pork is not vegan. This is a different scenario compared to an omni place with vegan options. The ethical standpoint isn't the focus for omni restaurants, whereas that's kind of the focus for most vegans. 🖤 I also overheard a ""carnivore"" order the chick'un burger because he didn't trust a vegan place to have fresh pulled pork (mind you, this comment was at 11 am today, aka right when they open on a Sat) so it was both great and confusing that the omni ordered a vegan dish, but didn't trust the omni option. So weird. 🖤 Anyway, I am so curious as to what you guys think about ""meat-options"" on vegan menus. Let me know down below! Also have you tried The Planet Diner yet?! I can't wait to go back to eat more donuts, and also eat the one I have saved for breakfast 🤫 🖤 #user_15 #theplanetdiner #stratford #whatveganseat #veganfoodshare"
user_15;user_15165.jpg;I'm trying to think of a positive and uplifting caption for these beautiful donuts from Beechwood doughnuts but it seems that I've hit the bottom of my well of positivity today. 🖤 This week is a tough week and I can't really share why, but I could use your good vibes right now. Life is all ebb and flow and this week it seems there's a lot of ebb happening. 🖤 A friendly reminder to take care of yourselves, mentally and physically. You are loved and you matter.
