person_id;image_id;caption
user_29;user_290.jpg;Which is your favourite 1 or 2 ? Legacy sports bras in the @gymshark sale starting in 5 minutes! All my faves are linked in my story ❤️
user_29;user_291.jpg;If it’s not tacos, burritos or any other kind of deliciousness... I don’t want it 😏 what’s for dinner tonight?! ( Recipe on the blog )#vegan
user_29;user_292.jpg;I must admit I’ve become a tad addicted to pick n mix in lockdown 🍬 😜
user_29;user_293.jpg;"If you add a protein bar to ice cream it makes it healthier right ?🙄🤣 Easiest ice cream sundae ever; 2 scoops vegan vanilla ice cream with one @myvegan banoffee protein bar and a drizzle (or bottle) of chocolate syrup and you are good to go 😛 Who is going to give this a go ?! #vegan #myprotein"
user_29;user_294.jpg;AD | Eeeek ok as if I needed a new @gymsharkwomen outfit to be obsessed with but here we are with the new legacy and it’s 🔥 30 minutes until this launches in a range of colours and alongside the new ombré! Check out my stories to see everything that is releasing at 7pm and thank you to everyone who shops through my link 🦋 - and thank you to my amazing mother who was grafted on an hour long trek for this photoshoot 😂
user_29;user_295.jpg;AD | are you seeing what I’m seeing ... brand new @gymsharkwomen ombré seamless launching tomorrow ! Comment below if you want me to do a try on haul and review of all the new releases coming on my stories tomorrow ?! 🦋
user_29;user_296.jpg;One of my favourite recipes from my blog ( link in story) and it’s perfect for summer bbq season 🍔 What’s your favourite vegan dish to bring to a bbq?! #vegan
user_29;user_297.jpg;If you need a fake away kinda dinner for your Sunday night then I have got you covered✌🏼 Epic #vegan fried rice coming to my blog today so keep an eye out on my stories for the link 🙏🏻
user_29;user_298.jpg;We need to keep on educating ourselves so we better know how to show our love , support and understanding ❤️Please Tag your favourite accounts / influencers below that are sharing useful information ! #blacklivesmatter
user_29;user_299.jpg;I am learning more and more everyday and I urge you to do the same. It’s not enough to consider yourself non racist , you have to be anti racist. Educate yourself as I am trying the best to do and see how you can try make a difference to help make change in this world. It’s mind blowing the information that is out there and right under our noses everyday that I know I have also not been paying a close enough eye to. I hope there is a day where we are all seen as one equal human race and not categorised by our gender, race, skin colour, sexuality. #blacklivesmatter
user_29;user_2910.jpg;#blackouttuesday
user_29;user_2911.jpg;Sometimes you have to be your own motivation. You have the be the one to decide today is day one and not go on in life thinking one day you’ll wake up and start treating yourself right. You don’t have to go crazy but you have to start somewhere. Eating healthy and working out is more than just aesthetics- sure they are a big part in the motivation but my god the confidence, the mental and physical benefits that exercise and healthy eating have given me are more than the aesthetics alone could give. There’s something about self love that just changes your life. I’m not saying you have to be in shape to love yourself but what I am saying is that you should love yourself enough to take care of yourself. This can be making a healthy breakfast and going a walk. It doesn’t have to be a six pack and protein shakes. Frankly I love the gym and healthy food and I can’t imagine not living the lifestyle I live but hello dessert and lazy Sundays doing absolutely nothing. Find what works for you, find your balance and find what you love about yourself in the process💛
user_29;user_2912.jpg;Finally a new blog recipe! Easy Peasy breakfast cookies! Naturallystefanie.com ✌🏼🍪 #vegan
user_29;user_2913.jpg;There is no right thing to say here but I feel it wrong to say nothing. Especially with 400k people reading what i share. It saddens me to think that people are treated unequal based on their skin colour, their religion, their sexuality , their gender. It has to stop. There are no perfect words but say something. Anything to show your support, your stance against racism and to help fight for what is right. Be the change you wish to see in the world. #blacklivesmatter
user_29;user_2914.jpg;5 minute cinnamon roll waffles for a weekend treat 👌🏼😜 - swipe for the video! #vegan
user_29;user_2915.jpg;AD | Which is your favourite ?! 1,2 or 3? New @gymsharkwomen flex range releasing in 15 minutes ❤️ Check out my stories for more info - you don’t want to miss this😍
user_29;user_2916.jpg;Spaghetti Napolitano recipe I made with @brettcobley on live earlier this week! . 🍝 Ingredients 100g spaghetti 4 cloves of garlic finely chopped 8 cherry tomatoes quartered 3 tbsp jar sundried tomatoes roughly chopped 120ml pasatta Pinch of salt 1 tsp Cracked black pepper 1 tsp parsley dried or fresh Method 1. Put 100g of spaghetti on to cook in a large pan of boiling salted water. 2. Add some of the oil from the jar of sundried tomatoes to the pan and add in the garlic and cherry tomatoes and soften for a few minutes. 3. Now add in the roughly chopped sundried tomatoes with half a cup 120ml of pasatta. Add in a pinch of salt and some cracked black pepper and keep on a simmer to thicken until the pasta is ready to add. 4. Remove the pasta from the water and add to the pan with the tomatoes and toss in the sauce until fully coated. 5. Serve up in two portions garnished with a sprinkle of parsley.
user_29;user_2917.jpg;I spent 26 years of my life hating coffee and now I’m addicted to whipped iced coffees on the daily - please see my collage of me and bae caught in a romantic moment ☕️
user_29;user_2918.jpg;AD | oh new flex who dis?! If you haven’t watched my recent YouTube video making some bomb vegan desserts from tik tok you definitely should .. i include an outfit change per recipe to show case the new @gymsharkwomen flex launching this Thursday 7pm BST! What do we think of this colour ?!
user_29;user_2919.jpg;Sunday ☁️
user_29;user_2920.jpg;In honour of @myproteinuk sweet 16th birthday I made this amazing strawberry freakshake protein shake 😛 All you need to do is blend banana, strawberries and strawberry protein with almond milk and top with vegan whipped cream and some extra toppings for sweetness 👌🏼 who wants one ?! #vegan
user_29;user_2921.jpg;"Who needs a post workout recipe idea or even a healthy brunch idea for the weekend ?! Chocolate banana protein pancakes - packed with plant based protein to refuel after a workout 😜 Make sure to always refuel with carbs and protein post workout ✌🏼 Who wants the recipe?! . 👇🏻 .  INGREDIENTS; - 4 scoops (100g) vegan @myproteinuk pancake mix - 150 ml almond milk - 1 ripe banana - Vegan chocolate sauce of choice  METHOD: 1. Mix together the pancake mix and milk until thick 2. Pour into a pre heated pan and cook on low heat either side; flipping when the batter is making bubbles or small holes and the edges browning 3. Stack high and top with banana and chocolate sauce! #vegan #ad #myprotein ."
user_29;user_2922.jpg;Some days we workout, some days we eat pizza with baked beans on top😅
user_29;user_2923.jpg;Don’t mind me just hugging my door frame since I can’t hug anyone else during lockdown 😅
user_29;user_2924.jpg;“A smoothie a day ...” (best captions wins)
user_29;user_2925.jpg;Sun-kissed skin ☀️ Theres something about a summer glow that just makes the skin look so much better ! Finished a solid week of LIVES with a goddess hour with @emj.makeupartist pampering the heck out of our faces for the world to see🥰 - what every Sunday should look like💛 Throwback to this time last year when I was honeymooning in Orlando ☁️
user_29;user_2926.jpg;"This is how every Sunday morning should look right? Protein pancakes from my cookbook! Chocolate protein pancakes with chocolate and strawberry toppings, whats your favourite pancake flavour?! Swipe for the recipe video 🙏🏻 . ☀️ . Ingredients: - - 70g @myprotein instant oats - - 30g @myprotein vegan blend chocolate protein powder - - 1 banana - - 1/2 tbsp baking powder - - 200ml almond milk - Strawberries - Vegan chocolate chopped (save half for melting over top) - Maple syrup . ❤️ . Method; - Blend the first 5 ingredients until smooth but do not over blend - Allow batter to sit and thicken for 5-10 minutes if it is runny - Add in half of your chocolate and stir - Pour into a preheated pan and cook either side until small holes / bubbles form in the batter - Stack and top with strawberries, melted chocolate and syrup #myprotein"
user_29;user_2927.jpg;"The most EPIC vegan toastie you’ll ever make in 5 minutes. Swipe for the video ! . ☀️ . Ingredients: - 4 slices of bread - 2 tbsp vegan pesto - 2 slices tofu - Sundried tomatoes - 2 slices vegan cheese . Method; - Layer all the ingredients between the bread slices and add to your toastie maker for 5 minutes or until crispy and golden!"
user_29;user_2928.jpg;"QUICK PROTEIN BALL RECIPE! This is my most popular recipe from my blog to date so it had to make an appearance in my cookbook (shop on amazon!) . ☀️ . Ingredients: - 150g dates - 1/2 cup powdered peanut butter - 1 cup oats - Vegan chocolate . Method; - Blend the first 3 ingredients until sticky - Roll into 8 golf ball sized bites - Coat in melted chocolate - Set in the fridge!"
user_29;user_2929.jpg;GIVEAWAY! 24 hours only - I have teamed up with my friends at @wearelani to giveaway a self love bundle featuring their Beauty Stone, Juice Cleanse facial cleansing oil (complete with organic bamboo face cloth), and award-winning Super Serum and a copy of my cook book which features recipes, workouts and daily rituals for a stronger, happier you. . ☀️ . To enter: 1. Like this post and follow @wearelani & @user_29 2. Tag up to three friends in the comment 3. Tell us why you’d love to win . ☀️ . T&C’s: To qualify you must follow @wearelani & @user_29. The giveaway is open worldwide. The winner will be announced tomorrow on my stories. The giveaway is not endorsed, or administered by, or associated with Instagram.
user_29;user_2930.jpg;All dressed up and nowhere to go 🦋
user_29;user_2931.jpg;Does anyone else go through phases of being totally obsessed with something and eats it until they hate it?! Yeah that’s me with protein smoothie bowls 😂 Chocolate and peanut butter banana smoothies with homemade granola is just something else😝 #MyProtein
user_29;user_2932.jpg;Caption this. Best one wins a copy of my cookbook. 🤘🏼
user_29;user_2933.jpg;Anniversary dinner at home vibes💛
user_29;user_2934.jpg;Lemon and spinach spaghetti with smoked tofu 🤭 I have a brand new “ What I eat in a day during lockdown” video going live later tonight if you want the recipe be sure to head over to my YouTube channel and subscribe 🙏🏻💛 #vegan
user_29;user_2935.jpg;Wooooooopa new @gymsharkwomen animal and marl seamless ranges dropping at 7pm! All the info you need is in my stories 💫 Happy Thursday, what are we all upto tonight whilst staying at home? I’m making spaghetti and garlic bread and watching a movie with the hubz ✌🏼
user_29;user_2936.jpg;"Need healthy snack inspo during lockdown ? Don’t forget to visit my blog Naturallystefanie.com for lots of recipes 🙏🏻 These are the millionaires slice and oh my ; you’ll be tricked into thinking these are dessert 😜"
user_29;user_2937.jpg;Happy hump day! How are we all doing in lockdown? 💙 That new new @gymsharkwomen seamless dropping tomorrow! Animal and marl seamless ranges dropping tomorrow at 7pm BST (April 23rd!). Check out my latest YouTube video to see how both sets look on 🦋 #gymshark
user_29;user_2938.jpg;Uhm can we taco ‘bout this Korean bbq taco recipe on my blog at user_29.com? Yeah I wish I was eating these right now. #vegan
user_29;user_2939.jpg;"Ad | Weekend vibes in the comfiest lounge set by @bouxavenue ! Come join me at 7pm on their Instagram live as I take you guys through a 20 minute post workout cool down / stretch routine ; perfect for a Sunday night chill! #myboux"
user_29;user_2940.jpg;Snickers protein balls coming to my blog tonight 🤭 You NEED healthy homemade snacks like these in your fridge especially at a time like this where all we want to do it eat eat eat 😂 Keep an eye on my stories for the link to the recipe ! #vegan #myprotein
user_29;user_2941.jpg;*quarantine mode
user_29;user_2942.jpg;Cookbook pancakes are looking damn good right now😅 I just wanted to say a huge thanks to everyone who has bought my book on amazon or Instore at Waterstones 🙏🏻💛 If you are too lazy to make your own pancakes you can always use @myvegan pancake mix and just add whatever toppings you like 😜
user_29;user_2943.jpg;Can you tell I’m easily bored?
user_29;user_2944.jpg;Peri peri cauliflower bites with peri mayonnaise are now on my blog at user_29.com🤤 a this is such a quick and easy recipe that I made for tonight’s pre dinner snack and I’m literally fighting Marco off eating it all😂 #vegan
user_29;user_2945.jpg;Anyone else just enjoying making so much food and baking all the goods this lockdown? Here are my cinnamon apple pancakes you can find on my blog using @myvegan pancake mix 🙏🏻
user_29;user_2946.jpg;I hope everyone is staying safe and well 💛 Comment below what you are doing this weekend whilst staying at home? I’m currently making a homemade Nando’s for dinner and cookies 🤭
user_29;user_2947.jpg;Your stylist could never. #avocuddle
user_29;user_2948.jpg;If you haven’t made a mug cake before you are missing out on such a quick and easy dessert ✌🏼 Recipe is in my new cookbook on amazon and I’ll be announcing the giveaway winners on my story tonight! 💛 #vegan
user_29;user_2949.jpg;The classic break your back to take a picture of your butt pose ✌🏼😎
user_29;user_2950.jpg;I’m not going to lie other than making one til tok today and taking one photo I’ve done absolutely nothing productive what so ever.
user_29;user_2951.jpg;Have you tried my blog post recipe where I use vegan protein pancake mix to make on the go breakfast muffins?! Full recipe at user_29.com 🙏🏻 #vegan
user_29;user_2952.jpg;Hoping you guys are all keeping positive, happy and safe ! I’ve had such a productive day and an epic leg workout in my garage so feeling good over here 😇✌🏼
user_29;user_2953.jpg;I have a “big batch recipes” blog post going live tonight on my blog to give you guys some suggestions on easy healthy meals you can make for yourself and store in the fridge or for the whole family! Keep an eye out on my stories for when this is live🙏🏻 What’s your favourite go to big batch recipe?! Comment below👌🏼
user_29;user_2954.jpg;Chocolate stuffed chocolate protein pancakes are pretty much the ideal breakfast and post workout meal 🙏🏻 anyone else have a chocolate obsession or is it just me? #vegan
user_29;user_2955.jpg;"New on the blog ; cookie dough protein slice 😜 These are super and easy to make and you can store in the fridge or freezer for snacks throughout the week🙏🏻 That’s if you can get your hands on a can of chickpeas at the supermarket ... #vegan"
user_29;user_2956.jpg;"A brand new lean green burger recipe just went live on my blog at www.user_29.com ; I promise it tastes better than it looks 😜🙏🏻 #vegan"
user_29;user_2957.jpg;"I never really workout from home but with what is currently going on around the world I will need to start doing so soon when and if my gym closes! A lot of you have been asking for home workouts so I wanted to share an at home upper body circuit with you from my @veganaestheticscommunity guide (at 25% off using code “VEGAN”). On the note of sales @gymsharkwoman are having a huge USA and Canada only sale over on their site starting tonight! Head to my stories for more information but this neo mint energy seamless outfit is 50% off! .  Workout; With home workouts because I cannot go heavy I use dumbbells (amazon) and perform circuits to add intensity in a different way. Perform each exercise for 30 seconds back to back, take 1-2 minutes rest and repeat! 1. Dumbbell single arm press left 2. Dumbbell single arm press right 3. Plank with shoulder taps 4. Renegade row with pushups 5. Dumbbell bicep curls"
user_29;user_2958.jpg;I don’t know about anyone else but I’m so glad it’s Friday 😂 What’s everyone’s plans this weekend?!
user_29;user_2959.jpg;"Ok is it just me or have my shoulders just came out of nowhere all of a sudden ?! Maybe it’s the camera lense 🙄😂 A brand new youtube vlog is about to go live and I am showing you all the new @gymshark releases coming tomorrow! They have a big campaign going all about sports bras; whether you are part of the itty bitty committee like me and like a more low impact style or your are someone that needs more support - they have you covered. Head over to my channel later tonight as I try them all on and give my very honest review of each of the styles :)!"
user_29;user_2960.jpg;Holding on to the Brussels sprout season as long as I can 😂 Garlic and teriyaki roasted sprouts over on the blog at www.user_29.com 🙏🏻
user_29;user_2961.jpg;"Newest recipe on the blog; Bang bang cauliflower! Naturallystefanie.com or swipe up in my story🙏🏻"
user_29;user_2962.jpg;"Ok I’ve went HARD on the content this week with the aim to upload a workout and a recipe every single day (Mon-Fri)! What do you guys think about the more frequent content? ... TONIGHTS recipe is this roasted broccoli and garlic spaghetti with vegan chicken strips ; head over to www.user_29.com for the full recipe 🙏🏻❤️ #vegan"
user_29;user_2963.jpg;"Ok what’s better than vegan pancakes ? How about vegan pancakes breakfast muffins?! I got creative here guys and guess what; you only need 3 ingredients to make your morning pancakes into super high protein breakfast muffins to grab on the go ... recipe at www.user_29.com 🙏🏻⚡️ #vegan"
user_29;user_2964.jpg;Latest recipe on my blog are these AMAZING Korean bbq soft tacos😑 Yes they are as good as they sound. www.user_29.com #vegan
user_29;user_2965.jpg;I’m a little bit obsessed with this outfit 😜⚡️
user_29;user_2966.jpg;I must admit I do love a Sunday, more so for the planning of the week ahead 🙏🏻 Remember a goal without a plan is just a dream so get yourself on track and train with me over at @veganaestheticscommunity 😜
user_29;user_2967.jpg;Ok if you make any recipe this weekend it HAS to be my homemade 3 ingredient protein bars that are now live on my blog at www.user_29.com 🙏🏻😜
user_29;user_2968.jpg;First leg day back since I’ve been home from my week away.. wish me luck 😅 What are we all training today?
user_29;user_2969.jpg;One pot 10 minute pad Thai now on my blog! Sometimes you want to throw everything in a pot and leave it to do it’s thing 💁🏼‍♀️ if this is you today then head over to Naturallystefanie.com for this recipe 🙏🏻 #vegan
user_29;user_2970.jpg;"Which is your fave; 1 2, 3 or 4?! I am not usually a shorts gal but omg I am a fan of the new energy seamless and vital seamless shorts; not too short, high waisted and snug as a bug in all the right places 😜 I am working on a YouTube video to show you these all on and for size reference I wear a U.K. 8, size small across all of @gymshark and I’m 5’5 with a non existent chest 🙃 These release tomorrow Thursday the 27th at 7pm! Happy hump day 💪🏼 #thanksmumforyourbathroomlighting #gymshark"
user_29;user_2971.jpg;Peaches and cream is one real messy pancake flavour to photograph 🤣 Still tastes amazing tho😜 Perfect protein pancakes everytime with @myvegan vegan pancake mix 🥞 #vegan
user_29;user_2972.jpg;I went to the gym once this week whilst I was away and spent the rest of the time eating pizza and donuts and touring with the family (it won’t kill you to do this every now and then)! I am excited to get back into routine this week though and get back to working on those 2020 goals 🙏🏻 I am a routine gal and start to get really antsy the end of holidays to get back to work😂 Train with me @veganaestheticscommunity 🍓
user_29;user_2973.jpg;1am pizza is always a good idea 🍕
user_29;user_2974.jpg;Casper trying to catch a tan but I think the hat and the SPF 50 is defeating the purpose 👻
user_29;user_2975.jpg;Touring 🌍
user_29;user_2976.jpg;7 down , 100 more to go ❤️🙏🏻
user_29;user_2977.jpg;Semi healthy protein oatmeal cookies just went live on my blog at user_29.com ✌🏼 I must warn you they are a tad addictive when you add chocolate chips😇
user_29;user_2978.jpg;Eeeek the training range will be live this Thursday the 13th at 7pm NST! I’ve had SO MANY questions about the hoodies and shorts I’ve been wearing in my recent posts: the essentials training zip ups, joggers, hoodies, sweaters and shorts will be live this week! Swipe for a video of some of the bits ✌🏼
user_29;user_2979.jpg;Bbq tempeh and black bean tacos for dinner tonight and omg you best be ready for the recipe on my blog tonight as these were delish 👌🏼😅 #vegan
user_29;user_2980.jpg;AD | How I imagine I would look if I moved to Australia 😂 unfortunately my extremely pale Scottish genetics would stick around so I rely on tan in a bottle for my golden glow🔥 Thanks to @lovingtanofficial for being vegan and cruelty free to allow me to do that ✌🏼use my code NATURALLYSTEFANIE for a free mitt with any mousse purchase
user_29;user_2981.jpg;"Brand new what I eat in a day video coming to my YouTube channel tonight showing you just how I use my new fav @myproteinuk product; the vegan clear protein! Trust me when I say this is a game changer 💙💪🏼"
user_29;user_2982.jpg;"Avon are now the first global brand to sell in China WITHOUT animal testing! This is such exciting news and makes their new distillery range 100% vegan and cruelty free! I used a few of their new products in my 5 minute natural everyday makeup routine; their lipgloss, mascara and eyeshadows are now a staple for my natural nude makeup look 🙏🏻 Be sure to check their new range out now! |AD"
user_29;user_2983.jpg;Apple cinnamon protein pancakes are an absolute must for breakfast when it’s still -6162883 degrees outside🧐 Thinking of just packing up and moving to Australia really🤣 Today I had to run half way down my street to retrieve my wheelie bin which was being kidnapped by the wind, poor guy didn’t know what was happening to him. Don’t worry. I saved him. I have a new YouTube vlog AND mini tik tok vlog going up tonight ... ohhh content production has been high as a kite this week and the way I’m typing makes it sound like I am too but fear not I am 100% not on drugs just high on life today my friends 🤓 ... and possibly maple syrup #vegan #ad
user_29;user_2984.jpg;"New recipe going up on my blog tonight; lentil and butterbean curry 🍛 what are you having for dinner? #vegan"
user_29;user_2985.jpg;It’s 2020 and people are still asking me where I get my protein #vegan
user_29;user_2986.jpg;FRIYAY 🥳
user_29;user_2987.jpg;AD It’s acceptable to eat pancakes for dinner if they are protein pancakes right?! The fluffiest chocolate protein pancakes with chocolate sauce and banana made using the @myproteinuk vegan blend protein powder 🙏🏻 Full recipe on my blog at user_29.com 🥞 #myprotein
user_29;user_2988.jpg;Apparently cancers and libras aren’t compatible but we are already breaking stereotypes so why not add another 💁🏼‍♀️ can you tell by my stories who the chaotic Libra is 😜 The best day filming some seriously funny content that I cannot wait to upload 🙏🏻 New @gymsharkwomen coming soon eeeeeeek🤤
user_29;user_2989.jpg;I think I’m going to move back into my parents house just for their bathroom mirror 😇
user_29;user_2990.jpg;Thank you to everyone who came to my book signing today! Of course I had to celebrate with a pizza 🍕 😜
user_29;user_2991.jpg;Swipe for some new @gymsharkwomen releases coming soon to kit you out for your #gymshark66 goals 🤭 A week of workout clothes in 8 seconds 😜 Brand new YouTube video just uploaded all about getting back on track this week post sickness 🐒
user_29;user_2992.jpg;Protein baked banana bread from my cookbook! I am hosting my first book signing this weekend on Saturday the 18th at Waterstones in Silverburn between 12-2pm! Eeeek so exciting 🙏🏻 #vegan
user_29;user_2993.jpg;2 days back in the gym, 1 off. Sounds about right. This cold is slightly lingering and the start to 2020 has been pushed back a bit as a result but we are getting there 😅 ps new @gymsharkwomen coming in hot 🥵
user_29;user_2994.jpg;Nothing like a fresh head of hair to make you forget that you are sick 😅 @bombshell.scotland #gifted
user_29;user_2995.jpg;"Easy on the go breakfast idea; overnight peanut butter and choclate oats 👌🏼"
user_29;user_2996.jpg;I must admit I’m not really one to make New Years resolutions or have a whole new life plan set out because the calendar changed its date but I must admit I’m really looking forward to making some new personal and business goals this year ✌🏼 For #gymshark66 my goal is to definitely be more productive and procrastinate less and this is includes in the gym (I talk way too much and am guilty for scrolling through social media between sets!) - what’s your goal ?
user_29;user_2997.jpg;Happy new year to my amazing community, so excited to enter 2020 with you all 🎄❤️
