person_id;image_id;caption
user_29;user_2998.jpg;A belated Merry Christmas and Happy holidays to all of you 🌟🌲
user_29;user_2999.jpg;Nom nom nom hello sofrita bowl from my cookbook (link in bio!) Sofrita tofu is one of those foods you make in a nourish bowl for dinner with rice and guac then use leftovers on toast for breakfast the next day ✌🏼 Quick and easy 2 meal idea🙌🏻 #vegan
user_29;user_29100.jpg;In a world where everyone is always out to compete or bring others down let’s give thanks to women who support women in making moves in their business but more importantly let’s have humans support humans for trying to be the best versions of themselves ✌🏼Grateful for all the amazingly supportive humans in my life 💛 Tag yours below and show your appreciation for them!
user_29;user_29101.jpg;"Ladies and gentlemen I will now accept my award for the best protein dessert of all time; the protein freakshake 🤭 A protein iced coffee a protein cookie and #vegan whipped cream 👌🏼 Recipe with @myproteinuk; 🌟 1. 1 cup ice 2. 1 cup almond milk 3. 1 scoop #myprotein vegan blend in chocolate smooth flavour 4. 2 tbsp raw cacao powder (also MP) 5. Coffee flav drops (also MP) 6. @myvegan baked cookie 7. Vegan whipped cream 8. Chia seeds or chocolate chips to top"
user_29;user_29102.jpg;Baby it’s freaking freezing outside and I don’t like it 🤭🌟 #fauxfur
user_29;user_29103.jpg;The most delicious vegan Christmas burger is coming to my blog tonight and you are not ready. A mushroom and chestnut patty layered with cranberry sauce, cheese and a roasted sprout slaw on top👌🏼 who wants one?! #vegan
user_29;user_29104.jpg;Ok absolute lols at this whole “start of the decade vs the end of the decade” comparison photo😂 16 vs 26 , can you imagine 16 year olds dressing like this now?!😂 I think not🤣
user_29;user_29105.jpg;Just shared a recipe from my cookbook (link in bio) on my blog user_29.com! The tofu chocolate mousse which is To. Die. For. Head over there to check it out ! I will be announcing the winners of my cookbook later tonight on stories 🌟✌🏼 #vegan
user_29;user_29106.jpg;Everybody gets bloated no matter how fit, healthy or shredded you are✌🏼 Just because you don’t see my feed covered in these types of pics doesn’t mean it doesn’t happen to me too 😇 Poor me and @nuttyfoodiefitness had a hard time in Manchester a few weeks ago, my digestion doesn’t do well when I travel😅
user_29;user_29107.jpg;One of my crowd favourite recipes from my cookbook! Lentil bolognese 🍝 This is such a quick and easy recipe and is perfect for winter time 🙏🏻 Been in such a pasta and bread mood lately and I’m lovinggggggg it😜 Don’t forget your can shop my book on Amazon(UK) and Wordery (USA) through my bio 🌟
user_29;user_29108.jpg;ad | If you are looking for some stocking fillers this Christmas I’ve got just the thing for you! If you are anything like me and like natural products that are cruelty free and are a fan of refreshing scents, then this is just for you! @SchmidtsUKI new charcoal range, complete with body soap and deodorant ✌🏼 The charcoal helps to cleanse pores with its detoxifying and purifying properties, perfect for the colder weather ❄ These have been my go to products from the brand lately, a staple in my winter routine and I absolutely love them! #SchmidtsNaturals
user_29;user_29109.jpg;I’m currently writing out my festive content for the next 4 weeks and omg I am just so excited to share so many new recipes and videos with you guys 👍🏻 To kick off the festive spirit I’ll be uploading Berlin vlog to youtube tonight showing you guys far too much good food 😅 If you have any video requests for the festive season please leave them below! The recipe for these sweet potato brownies can be found over at user_29.com and the swipe up is in my story! #vegan
user_29;user_29110.jpg;From big me and little me thank you to everyone for all of your love and support on my first book “Naturallystefanie”, the feedback so far has been amazing and I’m so grateful for everyone of you that support what I do! 🌟 Today’s event was so much fun and I’m now contemplating using this giant poster as my new office wallpaper?! What do we think🤣 *GIVEAWAY* I am going to be giving away 5 signed copies of my book to you guys as a small thank you (UK ONLY) and all you have to do is like this picture, follow @bwpublishing and comment below once you have entered!! (Closes Monday 9th)
user_29;user_29111.jpg;It may be winter but hello iced coffee mocha protein shakes ✌🏼 Last of the Black Friday sales use code STEFUK for 47% @myproteinuk 🙏🏻 #ad
user_29;user_29112.jpg;Last nights carb fest 🍝
user_29;user_29113.jpg;I look a tad evil but selfies are hard work so we are settling ✌🏼
user_29;user_29114.jpg;If the burger doesn’t end up on your face, half way up your arm and on your lap you aren’t eating it right (swipe🤣) #vegan
user_29;user_29115.jpg;The day has finally come, my book is officially published! Such an exciting day that I have thought about since I started Naturally Stefanie. Thank you to every single person who has already ordered their copy, none of this would be possible without all of you who follow me everyday, watch my videos and support everything that I do. I hope this book gives back to you and helps you live a happier healthier life 💛 The idea that I have an official hardback book in my hands with my face and name on it is mind blowing and is literary - without being cheesy - a dream come true. Whatever your own dreams and goals are I hope you keep chasing them. This is just the start, there is so much more yet to come 🙏🏻
user_29;user_29116.jpg;Woooo my Black Friday @gymsharkwomen sale video is going live TONIGHT! Everything you need to know about the sale next week 🤭 I feature my favourites, new releases, discounts and basically all of the must know info 👌🏼 ahead on over at 7pm to watch! AD
user_29;user_29117.jpg;Reunited with the girl that still can’t spell her name correctly 😇
user_29;user_29118.jpg;Banana and cream protein pancakes this morning ooooh it feels so wintery and I dare say I’m even getting excited for Christmas 😅🤭 #vegan
user_29;user_29119.jpg;My everyday protein smoothie made with my new addiction @myproteinuk strawberry protein omg yellow strawberry milkshake for lunch everyday 👌🏼🙏🏻 #sp #vegan
user_29;user_29120.jpg;AD | I always use @Spotifyuk when I train especially their “you can do it” playlist! Go and listen to it for that extra motivation during your workout 🏋🏻‍♀ Those squats aren’t going to do themselves 👌🏼
user_29;user_29121.jpg;Happy Friday from a fresh faced fania 💛 What’s your plans this weekend?!
user_29;user_29122.jpg;My protein ball recipe is one of my most popular blog recipes so here it is in video form! Comment below if you like these recipe videos so I know to make more 🙏🏻⚡️#vegan
user_29;user_29123.jpg;#AD Goodbye dry winter hair: you have officially been quenched. As the days grow shorter and the evenings get darker, it’s the perfect time to hibernate and pamper yourself from the comfort of home, so I’m taking time to share with you my all-time favourite vegan and cruelty free shampoo and conditioner, not only does it smell ah-mazing, it’s blended with aloe vera and coconut water, leaving your hair feeling and looking like a product straight out of a tropical tv ad @mauimoistureuk #BeMoreMaui
user_29;user_29124.jpg;Was so focused on the tattoo reading properly off camera and mirror that I didn’t think to make sure it wasn’t upside down. (Flip phone lawl). Happy Halloween.
user_29;user_29125.jpg;Vegan sausage and pesto pasta! Less than 10 minutes, one pot and one blender 👌🏼 Full recipe at user_29.com 🙏🏻 Would you make this ?! Like if you want to see more recipe videos on my page ⚡️
user_29;user_29126.jpg;Monday motivation to get back into my training after a week off sunning myself (not really) ☀️ Got home to a @gymsharkwomen delivery and omg can we take a moment for the geo seamless please 🙏🏻 This is still available in most colours and sizes check out the details in my story! #sp . What did you guys train today?!
user_29;user_29127.jpg;6 months today ❤️
user_29;user_29128.jpg;ADVENTURE
user_29;user_29129.jpg;Look out Dubai there is a Scottish troll doll falling from the sky 😜
user_29;user_29130.jpg;Back to the sunshine and my sissy this week ❤️ #ishalltrytanthistime
user_29;user_29131.jpg;BOOK COVER REVEAL! Can you BELIEVE IT?! A book, by me, getting published November 26th 2019! This has always been on my list of things I want to achieve and bring to the world and I am so excited and thankful that I have the opportunity do release a real life BOOK! A lifestyle cookbook packed with plant based recipes paired with home and gym workouts 🙏🏻 Available for pre order so so soon! Eeeeek what is my life 🤭🌱
user_29;user_29132.jpg;26 🥳
user_29;user_29133.jpg;"Archive; Final wedding dress fitting 6 months ago 🤭👰🏼"
user_29;user_29134.jpg;AD| I get tons of questions about my skin and products I am using to keep it clean and breakout free - here is the answer. My go-to skincare device for months now is LUNA mini 2 and I am always using it after working out to remove the sweat and dead skin cells off my face. It offers you different levels of pulsations, you can apply your cleanser on the brush or on the face and just do circular motions. The feeling when using it is great cuz it's also a nice massage treatment. Check it out on their page! What are your fav skincare products? @foreo_uk #lunamini2 #lookfantastic @lookfantastic #postworkout #skincare #workoutmotivation
user_29;user_29135.jpg;Cinnamon apple protein pancakes from my fall 2019 12 week challenge launching tomorrow! Complete with both gym and home workout guides, a fully plant based meal guide and a supportive community : join us today using code “FALL19” for 10% off the challenge! (That’s 27p a day to put towards your health and fitness goals) 🤭 Releases tomorrow October 11th 12pm BST 🙏🏻🌱
user_29;user_29136.jpg;Tried something new today to test out the functionality of the new @gymshark non stop range releasing tomorrow October 10th 7pm BST! This range is so unbelievably soft and comfortable yet so functional and practical for the gym. I wanted to try more explosive moves and a more fast paced workout today to see how the leggings held up espcaily and wow they didn’t even BUDGE! No pulling up necessary. I will have a full instagram story and youtube try-on for the entire range tomorrow but for now enjoy my 1 minute attempt at a cool video edit lawl.
user_29;user_29137.jpg;Super easy thai green curry for dinner 🙏🏻 sauce just made with coconut milk and blue dragon green curry paste! #vegan
user_29;user_29138.jpg;Homemade peanut butter crisp protein bars now on my blog At user_29.com and oh my you will LOVE me for these .. link in my story for the recipe 💛🌱
user_29;user_29139.jpg;Sofrita bowl ! Chipotle spiced tofu, brown rice, guacamole and lime all coming soon in my lifestyle cookbook launching in November eeeeeek can you believe next month I will have a BOOK?! A real hardback solid physical hold in your hands and hug yourself to sleep book?! 😂🌱
user_29;user_29140.jpg;When they ask for a spring roll ... Stefanie doesn’t share food (swipe) 😜
user_29;user_29141.jpg;Sun kissed ? More like sun missed, 42 degrees 🙅🏼‍♀️
user_29;user_29142.jpg;Who saw my #GymsharkxWhitneycollection IGTV try on yesterday? This collection is coming out TONIGHT Thursday 26th September at 7pm BST! I wear a size small in everything but would size down to XS in the joggers 🙏🏻 Thanks to everyone who uses my commission link in my story and my bio 💙 #gymshark
user_29;user_29143.jpg;You guys are going to be thanking me tonight with this sweet potato chocolate chip brownie recipe .. utterly butterly delicious , finger licking good, healthy too🤭 You. Are. Welcome. #vegan
user_29;user_29144.jpg;The only day I managed to go outside and I hid under the umbrella 😅 Dubai vlog coming tonight to YouTube 🙏🏻
user_29;user_29145.jpg;Here’s me trying to play dress up but if you zoom in really close to my lips you’ll see my lipstick smudged all over my tash 💁🏼‍♀️
user_29;user_29146.jpg;I’ve never actually surfed a day in my life 🏄‍♀️
user_29;user_29147.jpg;My first ever job at 14 years old was delivering @avon_uk books to my family and neighbours and now they have changed the game with their new Distillery collection which comprises of 9 vegan friendly skincare products that are just amazing! My favourite product is the c-shot which is pure vitamin c for brighter more glowing skin 🙏🏻 Not only are the ingredients vegan friendly but the products are designed with environmentally conscious packaging ♻ Check out my story for a link to check them out 🙏🏻 #ad #AvonDistillery #avonbyme
user_29;user_29148.jpg;"Ok so as you probably know I am not a coffee drinker, infact any kind of caffeine is not for me BUT on my honeymoon at the start of the year I may have created a mocha Frappuccino almond milk no whip addiction ... maybe. So since I am flying out to Dubai today ie I’ll skipping lunch aka my regular protein smoothie and I’ll need to try stay awake for jet lag and all that fun stuff I thought I’d make an epic concoction ☕️ This my friends is a copycat mocha frapp aka the mocha iced protein shake! You will need; . - 1 scoop @myproteinuk vegan blend chocolate smooth protein - 2 tbsp #myprotein raw cacao powder - 2 tbsp @sweetfreedomuk caramel chocolate sauce - 1 cup ice - 1 cup almond milk - 1 tsp coffee (or decaf) . Blend that baby up and thank me later 💁🏼‍♀️ #sp #vegan"
user_29;user_29149.jpg;Weekend work 💪🏼 Who trains at the weekend?!
user_29;user_29150.jpg;The blonde diaries 💁🏼‍♀️
user_29;user_29151.jpg;Peanut nourish bowl come at me brooooo 👌🏼The recipe for this will be both on my blog and tonight’s YouTube video so keep an eye out on my stories to grab it🙏🏻 #vegan
user_29;user_29152.jpg;Belly full of pizza and I am happy 🍕
user_29;user_29153.jpg;#AD | autumnal feels creeping into my life and a new @schmidtsuki Deodorant Stick to match - it’s vegan friendly too! 💕 Made from ingredients derived from nature, this natural deodorant is certified vegan, cruelty free and helps to neutralise odour to keep you fresh🙌🏻 @schmidtsuki @ocadouk
user_29;user_29154.jpg;Two weeks until I am reunited with my sissy and oh my goodness I have started packing my bikinis already 😂 You guys comment down below what there is to do in Dubai , the best places to go and where to eat !! #teamnoboobs
user_29;user_29155.jpg;How every weekend should look 🍕
user_29;user_29156.jpg;How do we feel about super healthy banana bread with a @myproteinuk vanilla protein twist in there?! I’ll tell you how I feel .. ITS AMAZING. Recipe coming in my upcoming health and fitness lifestyle cookbook eeek I cannot WAIT for you guys to see this 🤗 #sp #myprotein
user_29;user_29157.jpg;"Hey guys so the new new @gymshark high waisted flex range and seamless are launching this TONIGHT THURSDAY 29th August 7pm BST! I wear a size small in this shorts, bra and crop top. I LOVE high waisted flex, as you know I was not a fan of the original flex as the waistband was too low but the high waisted launch is by far one of my favourite sets to date. Contour lines on the butt, thick squat proof fabric, minimal branding on the front and a party in the back. The seamless range is also releasing so please stick around to the end of the video for the last two outfits; the green is my absolute fave! Such flattering sets all worn by me in a size small! @gymsharkwomen"
user_29;user_29158.jpg;Always got my fridge stocked with these bad boys👩‍🍳 Homemade vanilla protein balls coated in chocolate 👍🏻 Recipe on the blog user_29.com ❤️
user_29;user_29159.jpg;All booked back up to go to Dubai next month and visit my sissy! She’s only moved away a week and we can’t handle it 😂
user_29;user_29160.jpg;"Lentil bolognese if you please 🤭🍝 Recipe from my upcoming cookbook below; . Ingredients: * 100g spaghetti, dry weight * 1 tin green lentils, in water * 1 yellow pepper, chopped * 1 white onion, chopped * 1 tin chopped tomatoes * 2 garlic cloves, minced * 2 red chillis, chopped * 1 tbsp tomato paste * 1 tbsp paprika * 1 tbsp black pepper * ½ tsp salt  Method:  1. Cook the spaghetti following the pack instructions 2. Add the garlic, onion, chilli and chopped pepper to a preheated, non-stick saucepan and cook on a medium heat for 3-5 minutes 3. Once these have cooked, stir in the chopped tomatoes, green lentils, tomato paste, paprika, black pepper and a sprinkle of salt, bring to boil them turn down the heat and allow to simmer for 20 minutes 4. Remove from heat and serve with the cooked spaghetti #vegan"
user_29;user_29161.jpg;Homemade nutty granola from my upcoming COOKBOOK coming in November eeeeeek! Takes less than an hour and can be stored and enjoyed all week long 🙏🏻 I can’t wait for you guys to see this year long project I’ve been working on I hope you love it as much as me💙💙
user_29;user_29162.jpg;After this crazy week if someone could post me this scran from @eatbychloe I would be eternally grateful 😉❤️
user_29;user_29163.jpg;My new version of Netflix and chill, at home laser hair removal whilst catching up on the latest episode of Vampire diaries 🙌🏻 I uploaded a whole YouTube video on my at home laser hair removal experience as it has been something I have been looking into doing professionally in the past but hello breaking the bank and a heck of a lot of pain! the results of my @Kenzzi__ so far: I don’t know about you but after 10+ years of under arm shaving I need to do it almost daily and hello inconvenient 😂 After only a few weeks I’m down to just once a week 🙌🏻 Use the discount code Stef40 to get 40$ off the @kenzzi__ handset!❣ #kenzzi #sp
user_29;user_29164.jpg;Dinner tonight ✅Homemade mushroom soy burgers and seasoned wedges 🙏🏻 Swipe up link for the recipe in my story 🤘🏼
user_29;user_29165.jpg;New blueberry lemon protein pancake stack just went live on my blog at user_29.com 🥞 #vegan
user_29;user_29166.jpg;Anyone else got a weekend brunch addiction?! Protein waffle recipes on my blog at user_29.com 🙌🏻 Code STEFUK for 35% off @myproteinuk for all your vegan protein goodies 🤘🏼 #myprotein #sp
user_29;user_29167.jpg;New vital seamless colour ways! Khaki, blue an coral among with pink (not featured) : I don’t have complete sets yet so here are the tops and sports bras for colour reference! This is THE COMFIEST range of all @gymsharkwomen clothing especially when paired with big joggies like these 😜 Check our my stories for my sizing and swipe up to shop the new colour ways dropping at 7pm BST! What’s your favourite ??
user_29;user_29168.jpg;"Lunch from my latest YouTube video; homemade falafels with creamy tahini and chilli salad dressing 🙌🏻 oh oh cookbook recipes are going to start appearing on the gram and I’m oh so exciteddddddd 🙌🏻 #vegan"
user_29;user_29169.jpg;Caption this below ..😅
user_29;user_29170.jpg;Sunday funday with me and my sweaty forehead 💪🏼
user_29;user_29171.jpg;Sri Lankan potato curry from last nights dinner YUM🙌🏻 Currently in a hotel room in London looking on deliveroo for something that will match my own dinner cravings! 😜 Comment your suggestions below on what to order! Recipe for this curry will be on my blog tonight ❤️
user_29;user_29172.jpg;"Society has a distorted perception of beauty. In a world where you can be anything; be you ❤️"
user_29;user_29173.jpg;I am so excited to let you guys know that I am hosting an event this coming Saturday August 3rd with @eatbychloe at the O2 in London! We are hosting a hula hoop and brunch morning with a chat by me all about fitness and food and how to have a balanced lifestyle! The event is at 9:15am and has limited spaces so visit the link in my stories if you want to come along and have brunch! 🥞 #ad
user_29;user_29174.jpg;Is anyone else out there addicted to chocolate ?🙋🏻‍♀️🍫 No .. just me? Ok😝 Well if you are even slightly a chocolate fan you have to try these chocolate banana bread squares🙌🏻 I’ll link the recipe in my story for you to find 🙌🏻
user_29;user_29175.jpg;Scottish summer is a thing after all ☀️
user_29;user_29176.jpg;Sometimes the messier the food the better it looks to me 😜 Vegan #myprotein pancakes ! .. what else are Sunday’s made for? #myprotein #sp #vegan
user_29;user_29177.jpg;This has been my go to dinner lately and it takes just 10 minutes 🙌🏻 Teriyaki tofu stir fry bowl with brown rice, tortilla and sriracha mayo .. YUM 🍲 #vegan
user_29;user_29178.jpg;Grateful 🌎💙
user_29;user_29179.jpg;Feeling extremely grateful today for this amazing career I have and amazing people I get to do it with 🙌🏻 Thanks to everyone who came and said hello at the #liftmanchester pop up store today with @gymshark it was an insane experience 🌎💙 Roll on day two tomorrow!
user_29;user_29180.jpg;Tomorrow is the day! Manchester we are taking over the Victoria warehouse for the @gymshark pop-up! I’ll be doing a causal meet and greet 2-5pm Saturday and then 10-1pm Sunday! I’m so excited to see the space and get to meet everyone 🙌🏻 #gymshark
user_29;user_29181.jpg;Didn’t your mother ever tell you not to play with your food? 🍕
user_29;user_29182.jpg;Chocolate. Caramel. Protein. Slice. You are welcome : user_29.com 💫
user_29;user_29183.jpg;Angel with a shotgun 💫
user_29;user_29184.jpg;HAPPY FRIDAY! What a crazy busy yet super productive week, thanks so everyone who has signed up to the summer challenge , we are in this journey together and I’m so excited for what next week is going to bring 💙🌎 I’m now off for a well deserved burger and all da chips 😂 #mentallyineed20kcalories
user_29;user_29185.jpg;I have mastered the ultimate veggie burger : chilli relish, homemade patty with jalapeño and onion topped with fiery slaw in a toasted bun ... full recipe coming soon 😜😜 #vegan
user_29;user_29186.jpg;My girls ❤️
user_29;user_29187.jpg;Wifey ❤️
user_29;user_29188.jpg;The three musketeers since day one 🙌🏻
user_29;user_29189.jpg;Forever ❤️
user_29;user_29190.jpg;No idea what I would do in this life without you sissy ❤️
user_29;user_29191.jpg;Reminding him he is now stuck with me for life 😜
user_29;user_29192.jpg;And the wedding gallery is in! 2.5 months into marriage where has the time gone?! 27/04/2019
user_29;user_29193.jpg;About to share the recipe for the best double chocolate espresso protein pancakes your tastebuds have ever experienced over on my blog 🥞 #vegan #myprotein #sp
user_29;user_29194.jpg;Tonight’s dinner from my upcoming summer challenge is this 5 minute cheesy gnocchi ! Super high in protein and perfect for a lazy yet super healthy post workout meal 🤘🏼
user_29;user_29195.jpg;NEW BLOG POST! Strawberries and cream french toast omg drooling just thinking about it again🥰 www.user_29.com #vegan
user_29;user_29196.jpg;Day date in the capital with the husband ❤️
user_29;user_29197.jpg;Weekend snack cravings SORTED! Cookie dough protein balls 🙌🏻 user_29.com 💅🏻
user_29;user_29198.jpg;Can you believe I was honestly annoyed at myself yesterday for not being where I want physique goal wise ?! I mean we are never truly going to be 100% satisfied with how we look but we should always be proud of what we have achieved so far💪🏼 I think going on a cut for my wedding (it was necessary to fit in the dress haha) had me side tracked from my long term goals - build some more lean muscle mass and strength ... it’s my favourite place to be 🤘🏼 i hope you all share your goals down below and remember how hard you have worked and what you have achieved along the way 🙌🏻
user_29;user_29199.jpg;Hello breakfast on the go 💁🏼‍♀️ if you know me from my what I eat in a day videos you will know that chocolate oats are pretty much my addiction and i cannot function in life without them 💆🏼‍♀️ SO when i need to be OOO and eat on the go I make them up the night before and layer with @myproteinuk powdered peanut butter and chocolate sauce to make and somewhat epic peanut chocolate breakfast trifle .. oh that could be a thing! This is one of the recipes from my @veganaestheticscommunity Spring 2019 meal guide and just you wait until you see what the Summer 2019 plan is bringing you on July 1st 💅🏻 #vegan #sp #myprotein
